{
  "application_build": {
    "artifact": {
      "identity": "sha256:8e554bca6e1c00781d1ee15cac2b4644c656e1a7becd13617eb4d46382e7096d",
      "interface_identity": "aa7e06b0f36619ac0d90aecde92235c97e9165bd871e07a98310ed033e0e7f47",
      "required_capabilities": [],
      "schema_version": "mncs.vm.artifact/1",
      "target": {
        "assumptions": [
          "mncs-vm executes selected SSA under VM-owned runtime rules"
        ],
        "candidate": "mncs:target:mncs-vm-0.1",
        "evidence": [
          "mncs:target-evidence:mncs-vm-0.1:declared-vm-contract"
        ],
        "facts": {
          "bounded-iteration": "preserve language-owned bounded iteration regions and backedges",
          "failure": "MNCS SSA explicit failure semantics",
          "integer": "MNCS SSA integer semantics",
          "runtime": "mncs-vm reference engine",
          "serialization": "canonical JSON artifact"
        },
        "identity": "mncs:compiler:target-contract:dda292ec5a6fa67f0e972c041b5b60bcb24ff856f8565656b8139d8080be1ce9"
      },
      "unresolved_obligations": [],
      "value": {
        "artifact_id": "sha256:8e554bca6e1c00781d1ee15cac2b4644c656e1a7becd13617eb4d46382e7096d",
        "assumptions": [],
        "callables": [
          {
            "function": "mncs:0.4:ssa:function:a2993bd9417cd419d528da45e519430191dc3be59835807c8f7aa8da6d95704a",
            "module": "rights.handoff",
            "name": "run"
          }
        ],
        "code": {
          "mncs-selected-ssa": {
            "module": {
              "nodes": [
                {
                  "S": "functions"
                },
                {
                  "S": "blocks"
                },
                {
                  "S": "failure_target"
                },
                {
                  "S": "mncs:0.4:ssa:failure:a2993bd9417cd419d528da45e519430191dc3be59835807c8f7aa8da6d95704a"
                },
                {
                  "S": "identity"
                },
                {
                  "S": "mncs:0.4:ssa:block:ddbc06bcb80ec7c3c2cc403c4de566f591bc9d9365567d7bd8b0111f3c1c834e"
                },
                {
                  "S": "instructions"
                },
                {
                  "S": "assumptions"
                },
                {
                  "A": []
                },
                {
                  "S": "capability_uses"
                },
                {
                  "S": "contracts"
                },
                {
                  "S": "effects"
                },
                {
                  "S": "evidence"
                },
                {
                  "S": "failure"
                },
                "N",
                {
                  "S": "hir_identity"
                },
                {
                  "S": "mncs:0.3:ir:body-operation:5c8690ce1387fc59442cb920ba72119ea558a4c4524d96cfda33d2c300ed8b11:0"
                },
                {
                  "S": "mncs:0.4:ssa:instruction:d9761ce4206c097b84f9b6a8a8f2fdaca2a2c72ea71310e3becc19051e014a6b"
                },
                {
                  "S": "inputs"
                },
                {
                  "S": "kind"
                },
                {
                  "S": "Constant"
                },
                {
                  "S": "ty"
                },
                {
                  "S": "integer"
                },
                {
                  "S": "bits"
                },
                {
                  "I": 64
                },
                {
                  "S": "signed"
                },
                {
                  "B": false
                },
                {
                  "O": [
                    [
                      23,
                      24
                    ],
                    [
                      25,
                      26
                    ]
                  ]
                },
                {
                  "O": [
                    [
                      22,
                      27
                    ]
                  ]
                },
                {
                  "S": "value"
                },
                {
                  "I": 42
                },
                {
                  "O": [
                    [
                      21,
                      28
                    ],
                    [
                      29,
                      30
                    ]
                  ]
                },
                {
                  "O": [
                    [
                      20,
                      31
                    ]
                  ]
                },
                {
                  "S": "machine_intent"
                },
                {
                  "S": "obligations"
                },
                {
                  "S": "outputs"
                },
                {
                  "S": "block"
                },
                {
                  "S": "mncs:0.2:value:rights.handoff::run::entry::%24mncs%24c%240::%24mncs%24c%240"
                },
                {
                  "S": "producer"
                },
                {
                  "S": "semantic_identity"
                },
                {
                  "O": [
                    [
                      36,
                      5
                    ],
                    [
                      4,
                      37
                    ],
                    [
                      38,
                      17
                    ],
                    [
                      39,
                      37
                    ],
                    [
                      21,
                      28
                    ]
                  ]
                },
                {
                  "A": [
                    40
                  ]
                },
                {
                  "S": "mncs:0.2:operation:rights.handoff::run::entry::%24mncs%24c%240"
                },
                {
                  "O": [
                    [
                      7,
                      8
                    ],
                    [
                      9,
                      8
                    ],
                    [
                      10,
                      8
                    ],
                    [
                      11,
                      8
                    ],
                    [
                      12,
                      8
                    ],
                    [
                      13,
                      14
                    ],
                    [
                      15,
                      16
                    ],
                    [
                      4,
                      17
                    ],
                    [
                      18,
                      8
                    ],
                    [
                      19,
                      32
                    ],
                    [
                      33,
                      14
                    ],
                    [
                      34,
                      8
                    ],
                    [
                      35,
                      41
                    ],
                    [
                      39,
                      42
                    ]
                  ]
                },
                {
                  "S": "mncs:0.3:ir:body-operation:f52cd0587699511e5c74f3dc7136f308efbcd8d84d3af30d271b4ae20987d2a8:0"
                },
                {
                  "S": "mncs:0.4:ssa:instruction:1f328952302faa06ec04595dc9c22c7ce49a48c527bae36a5551fd939d82bf63"
                },
                {
                  "A": [
                    37
                  ]
                },
                {
                  "S": "RecordConstruct"
                },
                {
                  "S": "field_names"
                },
                {
                  "A": [
                    29
                  ]
                },
                {
                  "S": "type_identity"
                },
                {
                  "S": "mncs:0.2:record-type:rights.handoff::HandoffResult::value%3Au64%3B"
                },
                {
                  "O": [
                    [
                      48,
                      49
                    ],
                    [
                      50,
                      51
                    ]
                  ]
                },
                {
                  "O": [
                    [
                      47,
                      52
                    ]
                  ]
                },
                {
                  "S": "mncs:0.2:value:rights.handoff::run::entry::%24mncs%24rec%241::%24mncs%24rec%241"
                },
                {
                  "S": "record"
                },
                {
                  "S": "name"
                },
                {
                  "S": "HandoffResult"
                },
                {
                  "O": [
                    [
                      4,
                      51
                    ],
                    [
                      56,
                      57
                    ]
                  ]
                },
                {
                  "O": [
                    [
                      55,
                      58
                    ]
                  ]
                },
                {
                  "O": [
                    [
                      36,
                      5
                    ],
                    [
                      4,
                      54
                    ],
                    [
                      38,
                      45